{"audit":{"assessment_id":"urn:preflightops:assessment:sha256:7ff0733f64e23349f137a43d24737a879d8f791af8347747c2398c9f2b9c4e96","assessment_integrity":{"algorithm":"sha256","canonicalization":"preflightops-canonical-json-v1","value":"7ff0733f64e23349f137a43d24737a879d8f791af8347747c2398c9f2b9c4e96"},"assessment_schema_version":"1.0","assessment_timestamp":"2026-09-03T15:00:00Z","canonical_assessment_sha256":"67f6e05affc308248dcf83604f657967f0b20e9cbc0e95077c23850a1c184022","change_id":"CHG-2026-0808","commit":"aaaaaaaaaaaaaaaaaaaaaaaaaaaaaaaaaaaaaaaa","input_hashes":[{"hash":{"algorithm":"sha256","profile":"caller-supplied-sha256-v1","value":"cccccccccccccccccccccccccccccccccccccccccccccccccccccccccccccccc"},"name":"change-request"},{"hash":{"algorithm":"sha256","profile":"caller-supplied-sha256-v1","value":"dddddddddddddddddddddddddddddddddddddddddddddddddddddddddddddddd"},"name":"service-catalog"}],"pipeline":{"name":"preflight","url":"https://github.example.test/acme/checkout-api/actions/runs/8008"},"policy":{"hash":{"algorithm":"sha256","value":"bbbbbbbbbbbbbbbbbbbbbbbbbbbbbbbbbbbbbbbbbbbbbbbbbbbbbbbbbbbbbbbb"},"name":"production","version":"3.0.0"},"producer":{"name":"PreflightOps","version":"0.4.2"},"pull_request":"108","repository":"acme/checkout-api","run":{"attempt":2,"id":"8008"}},"automation_details":{"commit":"aaaaaaaaaaaaaaaaaaaaaaaaaaaaaaaaaaaaaaaa","included":true,"pipeline_name":"preflight","pipeline_url":"https://github.example.test/acme/checkout-api/actions/runs/8008","pull_request":"108","repository":"acme/checkout-api","run_attempt":2,"run_id":"8008"},"controls":{"counts":{"ERROR":1,"FAIL":1,"PASS":1,"UNKNOWN":1},"errors":[{"control_id":"validation-provider","evidence_ids":["urn:preflightops:evidence:sha256:dfae23d57ee10c904bf19167cc225c32dddac2641be4703cff903356eb6a1704"],"execution_id":"urn:preflightops:control:sha256:3dd2ea005a47fbb9ddaef9f81cf821c662d79525724f67632541a0946b3e8a2d","risk_points":0,"source":"stage-08-test","status":"ERROR","summary":"validation-provider produced ERROR."}],"failed":[{"control_id":"deployment-risk","evidence_ids":["urn:preflightops:evidence:sha256:310623ba8f4f9002c2b94325b4a47ca29c364f3acc4e5fb96c6522b1994e44a5"],"execution_id":"urn:preflightops:control:sha256:8ff10303d867f6f525bdccfa80a0a3b0a8a9682f09d41d0b846085bec0132726","risk_points":25,"source":"stage-08-test","status":"FAIL","summary":"deployment-risk produced FAIL."}],"passed":[{"control_id":"rollback-plan","evidence_ids":["urn:preflightops:evidence:sha256:be7f6b548365d5945e534649f31809c318300e6624376622cc384282a67a7ba2"],"execution_id":"urn:preflightops:control:sha256:aa0c44f8487cd8a0c98e6fbf76e8b6b59544b1182d83080415b4a7ee756b9d90","risk_points":0,"source":"stage-08-test","status":"PASS","summary":"rollback-plan produced PASS."}],"top_blockers":{"items":[{"code":"CONTROL_FAILED","control_id":"deployment-risk","message":"The control reported a failure."},{"code":"CONTROL_UNKNOWN","control_id":"monitoring-evidence","message":"The control result is not known."},{"code":"CONTROL_ERROR","control_id":"validation-provider","message":"The control could not be evaluated reliably."}],"omitted_count":0,"total":3},"unknown":[{"control_id":"monitoring-evidence","evidence_ids":["urn:preflightops:evidence:sha256:97564cc77456ddff9b322da4f6334ddcd921f43164f31d64e632c63c1188f054"],"execution_id":"urn:preflightops:control:sha256:bcbc8a90ff093da1d0cf84a4caf9454b27b6f4ad1c11ad8c30d789e34e053f40","risk_points":0,"source":"stage-08-test","status":"UNKNOWN","summary":"monitoring-evidence produced UNKNOWN."}],"warnings":[{"code":"CONTROL_UNKNOWN","control_id":"monitoring-evidence","message":"The control result is not known."}]},"data":{"classification":"internal","content_embedded":false,"redaction_profile":"preflightops-report-redaction-v1"},"decision":{"human_decision":{"actor_id":null,"authority":"external_cab_or_change_management","decided_at":null,"decision":null,"rationale_code":null,"status":"NOT_RECORDED"},"technical_recommendation":{"action":"DO_NOT_PROCEED","basis":"technical_only","grants_approval":false,"summary":"Do not proceed until the indeterminate controls are resolved."},"verdict":"INDETERMINATE"},"evidence":{"freshness_counts":{"FRESH":4,"STALE":0,"UNKNOWN":0},"provenance":[{"collected_at":"2026-09-03T14:55:00Z","control_id":"deployment-risk","evidence_id":"urn:preflightops:evidence:sha256:310623ba8f4f9002c2b94325b4a47ca29c364f3acc4e5fb96c6522b1994e44a5","freshness":"FRESH","hash":{"algorithm":"sha256","value":"2222222222222222222222222222222222222222222222222222222222222222"},"kind":"control-result","links":[],"source":"stage-08-test","valid_until":"2026-09-03T15:55:00Z"},{"collected_at":"2026-09-03T14:55:00Z","control_id":"monitoring-evidence","evidence_id":"urn:preflightops:evidence:sha256:97564cc77456ddff9b322da4f6334ddcd921f43164f31d64e632c63c1188f054","freshness":"FRESH","hash":{"algorithm":"sha256","value":"3333333333333333333333333333333333333333333333333333333333333333"},"kind":"control-result","links":[],"source":"stage-08-test","valid_until":"2026-09-03T15:55:00Z"},{"collected_at":"2026-09-03T14:55:00Z","control_id":"rollback-plan","evidence_id":"urn:preflightops:evidence:sha256:be7f6b548365d5945e534649f31809c318300e6624376622cc384282a67a7ba2","freshness":"FRESH","hash":{"algorithm":"sha256","value":"1111111111111111111111111111111111111111111111111111111111111111"},"kind":"control-result","links":[],"source":"stage-08-test","valid_until":"2026-09-03T15:55:00Z"},{"collected_at":"2026-09-03T14:55:00Z","control_id":"validation-provider","evidence_id":"urn:preflightops:evidence:sha256:dfae23d57ee10c904bf19167cc225c32dddac2641be4703cff903356eb6a1704","freshness":"FRESH","hash":{"algorithm":"sha256","value":"4444444444444444444444444444444444444444444444444444444444444444"},"kind":"control-result","links":[],"source":"stage-08-test","valid_until":"2026-09-03T15:55:00Z"}]},"integrity":{"algorithm":"sha256","canonicalization":"preflightops-canonical-json-v1","value":"321167f13c703bb3738df44069b2465e44d408d8e9653b52df5383379aaa1bfa"},"next_actions":{"items":[{"action":"Resolve the control error and rerun the assessment.","code":"RESOLVE_TECHNICAL_ERROR","control_id":"validation-provider"},{"action":"Collect fresh, digest-pinned evidence and rerun the assessment.","code":"COLLECT_TRUSTED_EVIDENCE","control_id":"monitoring-evidence"},{"action":"Remediate the failed control or follow the independently governed waiver process.","code":"REMEDIATE_FAILED_CONTROL","control_id":"deployment-risk"}],"omitted_count":0,"total":3},"rendering":{"include_automation_details":true,"max_text_length":320,"next_actions_limit":8,"pr_summary_max_characters":3500,"redaction_profile":"preflightops-report-redaction-v1","ticket_summary_max_characters":8000,"top_blockers_limit":5},"report_id":"urn:preflightops:assessment-report:sha256:321167f13c703bb3738df44069b2465e44d408d8e9653b52df5383379aaa1bfa","schema_version":"1.0","scores":{"confidence":{"basis":"fresh-digest-pinned-control-observations-v1","level":"MEDIUM","value":50},"risk":{"level":"HIGH","value":75}}}
